genre,definition
alternative r&b, worth pressure colors bitch yours flowers feelings pink mine freak outside body gold water used play feels pretty mood truth 
progressive house, asot abgt extended mixed trance apollo continuous flashback elements state mirage bloom phoenix avalon edit breathe sunrise club horizon together Progressive house subgenre house The progressive house style emerged early It initially developed United Kingdom natural progression American European house music late
electronica, edit parallel mixed acid dust chase milk echo dusk planet theme plastic chaos shining birds small golden endless untitled neon Electronica broad group music styles intended listening strictly dancing music scene started early United In United term refer electronic music
alternative hip hop, kool y'all check supreme corner brooklyn detroit hustle ghetto bonus snakes word food skit shit guns triple fresh smoke dollar Alternative hip hop known alternative subgenre hip hop music encompasses wide range styles typically identified AllMusic defines comprising hop groups refuse conform traditional stereotypes party blur genres drawing equally funk hip hop developed late experienced degree mainstream recognition While groups Arrested Development The Fugees managed achieve commercial success breaking alternative rap acts tend embraced alternative rock listeners pop The commercial cultural momentum impeded significantly West Coast gangsta A resurgence came late early dawn digital era rejuvenated interest independent music general alternative hip hop reattained place mainstream declining commercial viability gangsta rap crossover success artists Outkast Kanye The alternative hip hop movement expanded United States include poet English artist Alternative hip hop acts attained critical receive relatively little exposure radio media The prominent alternative hip hop acts include A Tribe Called De La The Digable Planets Black
folk, wreck railroad jesse pines thirty ballad ramblin' interview poor nashville band pilgrim mockingbird john willie hill lonesome farther roving betty Folk music music genre includes traditional folk music contemporary genre evolved folk Some types folk music called world Traditional folk music defined music transmitted music unknown music played traditional music cultural national music changes generations music associated music performed custom long period It contrasted commercial classical The term originated folk music extends new form popular folk music evolved traditional folk This process period called folk revival reached zenith This form music called contemporary folk music folk revival music distinguish earlier folk similar revivals occurred world term folk music typically applied new music created This type folk music includes fusion genres folk folk While contemporary folk music genre generally distinct traditional folk English shares shares performers venues traditional folk
pop edm, collide extended heartbeat alive feels lose find somebody without letting infinity losing runaway circles together wasted gravity horizon closer mixed 
metropopolis, gold future human wait years strange eyes running body golden magic dancing true pretty days kiss 
german pop, immer ohne alles wenn lass mehr nicht weit nichts deine vielleicht dich keine liebe halt ende akustik bist mich wieder 
brill building pop, what'd remastered twistin' pledging unchained tammy you've since twist cupid he's blowin' gonna cried walkin' you'll blueberry foolish chapel yesterday's 
argentine hip hop, interludio otra fuego bien nada fuck 
metalcore, sink buried oblivion sleepless hollow bleed bitter suffer wolves legacy enemy bury empire misery void hell false scars weight waste Metalcore known metallic fusion music genre combines elements extreme metal hardcore As styles blending metal crust punk metalcore noted use intense passages conducive Other defining instrumental qualities include heavy riffs rhythm guitar occasional blast double bass Vocalists genre typically use thrash scream Some later metalcore bands combine clean Death growls gang vocals metalcore bands inspired hardcore later metalcore bands inspired melodic death metal bands like At Gates In roots metalcore bands combine hardcore punk heavy This included New York hardcore bands like Agnostic Killing British hardcore punk bands like Exploited American crossover thrash bands like Dirty Rotten Imbeciles Suicidal The genre emerged early expanded Metalcore bands like Earth Shai Vision Disembodied emerged acquired underground success metalcore popular heavy metal subgenres success bands like Bleeding Avenged Killswitch Shadows As I Lay Bullet My All That popularity continued success bands like Asking August Burns Devil Wears Metalcore subgenres like easycore electronicore emerged Other subgenres metalcore include nu melodic metalcore progressive
rap rock, bleed enemy panic sick bullet kill burn waste underground killing murder drowning wake self hate psycho fuck rise breathe fear Rap rock fusion genre fuses vocal instrumental elements hip hop forms Rap popular subgenres include rap metal include heavy metal hardcore
vapor trap, choppa racks bands slime woah gucci yung bankroll jugg rick drip designer lifestyle missed gang options freestyle fuck dawg sticks 
ccm, performance maker faithful christ greater overflow redeemer holy worthy revival jesus lift reigns grace goodness praise emmanuel hallelujah unto glorious CCM refer centimetre metric unit change mitigation climate change
garage rock, shake evil pretty heavy gotta dirty gonna Garage rock called garage punk raw energetic style rock roll flourished notably United States experienced series subsequent The style characterized basic chord structures played electric guitars distorted unsophisticated occasionally aggressive lyrics Its derives perception groups young amateurs rehearsed family US surf later Beatles beat groups British thousands young people form bands Hundreds acts produced regional national usually played AM radio With advent numerous garage bands incorporated exotic elements primitive stylistic After sophisticated forms rock music came dominate garage rock records largely disappeared national regional movement Other countries experienced similar rock movements characterized variants garage garage rock recognized distinct genre specific critical hindsight early especially compilation album define memorialize Between certain American rock critics began retroactively identify music genre years term describe making form music bear predating familiar use term appropriated later punk rock movement The term gained favor commentators devotees The style referred certain instances early revival scenes emerged featuring acts consciously attempted replicate look sound garage Later contemporary garage subgenre developed combined garage rock modern punk rock garage punk label originally associated garage In wave acts associated revival achieved commercial Garage rock continues appeal musicians audiences prefer musical
urbano espanol, dinero joven ojal calle mami dime estoy morir veneno otra nada siempre miedo fuera sigo siento duele fuego sangre creo 
big room, extended mixed rave lose drop memories Big room refer large room modern Western largest room medieval known equivalent Japanese room subgenre electro house dance music
mpb, acalanto qualquer vento quase manh estrada brasil felicidade doce velho menino trem quem samba fundo tudo depois olhos dizer estrelas MPB refer pattern pine barkbeetle US Canada
swedish pop, aldrig innan allt vill faller stanna inte utan hela bara allting kommer sista vart igen rsta ingenting lska stilla samma Swedish popular shortly Swedish pop refers music swept Swedish mainstream given point recent After World War Swedish pop music heavily influenced American developing dansband Since Swedish pop music come international prominence bands singing ranking high New Australian charts making Sweden exporter popular music gross domestic
italian pop, milano tutto niente senza dove quello giorno l'amore prima storia mondo tutti cosa vita sono sempre amore sole canzone notte The expression Italian popular music refers musical output usually considered academic Classical music roots popular defined defined terms current geographical location Italian Republic exceptions Germanic South Tyrol eastern portion Friuli Venezia defined music produced people consider Italians openly implicitly refer Both definitions complex political history Italian Peninsula different independent political cultural linguistic traditions sprang difficult define considered truly Since formation unified educational system spread information radio press different cultural linguistic groups country independent unified Italian country political ideological concept far daily
opm, ikaw bakit paano kahit hanggang kung huwag walang mahal isang hindi ibig awit sana kaya wala alam langit nang sayang OPM refer
drift phonk, blade slowed eclipse adrenaline destruction killa cursed glock tokyo abyss pursuit creep revenge deadly rage blast eternity buck bloody memphis Phonk subgenre hip hop trap music directly inspired Memphis Mostly present SoundCloud music characterized vocals old Memphis rap tapes samples hip combining elements jazz The genre deploys distorting techniques chopped screwed create darker developed Southern United mainly Houston early pioneers include DJ DJ Spanish DJ collective Three In streaming platforms genre developed emphasis jazz classic hip TikTok drift community social subgenre phonk emerged main features use floor drum cowbells high It generally videos showing drifting
detroit hip hop, shit ghetto dope boss gangsta skit fuck freestyle bitch shine kill game street play same made wake major center United States creation performance best known early punk rock Metro Detroit area rich musical history spanning past beginning revival Detroit Symphony Orchestra The major genres represented Detroit music include rock electronica The greater Detroit area birthplace primary venue numerous total album according surpassed million units The success artists quadrupled figure decade
anime, size vocal edit album sakura acoustic brand dive scarlet brave dear shining prologue short shooting twinkle infinity brilliant everlasting destiny Anime song anime shortened anison genre music originating Japanese pop Anime songs consist image songs video audio drama CD song released primarily anime including music Japanese voice anime song genre defined musical category It later gained popularity public mainstream artists begin releasing songs anime By redefined separate genre companies began creating record labels exclusively produce anime songs series The increase voice actors beginning mid led growing market interest
pluggnb, freestyle fake hate fuck Plugg spelled subgenre trap stems production style later polished expanded beatmakers Beatpluggz mainly StoopidXool PoloBoyShawty online distribution platform mainline defined bombastic production rattling drum plugg said described having overall lush jazzy harmonies relaxed drum programming thick Instead mainline plugg drumming mainly employs beat crash cymbals punctuated accent snares As described plugg best intended heard way trance isolated plugg ranges instrumental beats songs rapping mellow Rapping range aggressive relaxed
hardcore hip hop, rhyme lyrical brooklyn y'all gangsta gunz beef hood ghetto check niggaz skit respect spit street freestyle shit duck shot hustle Hardcore hip hop hardcore genre hip hop music developed East Coast hip hop scene Pioneered artists Schoolly Boogie Down Productions Public generally characterized aggression
synthpop, demo remaster extended ordinary skin being shame london other watching sister kiss planet single love's boys rhythm monkey version talking synthesizer called subgenre new wave music prominent late features synthesizer dominant musical It prefigured early use synthesizers progressive art particularly Krautrock bands like It arose distinct genre Japan United Kingdom era new wave movement late musical synthesizers practically recording studio available saw rise electronic art After breakthrough Gary Numan UK Singles Chart large numbers artists began enjoy success sound early In Yellow Magic Orchestra introduced rhythm machine popular band major influence early British The development inexpensive polyphonic definition MIDI use dance led commercial accessible sound adoption acts New Romantic rise led success large numbers British acts US Second British term coined Yuzuru Agi critique The considered case multiple discovery term interchangeably generally scene Japan preferred term interchangeably denote variant places emphasis electronic In mid late duos Erasure Pet Shop Boys adopted style highly successful US dance end bands Alphaville giving way house music Interest new wave began revive indietronica electroclash movements late enjoyed widespread revival commercial genre received criticism alleged lack emotion prominent artists spoken detractors believed synthesizers composed played music established place synthesizer major element pop rock directly influencing subsequent genres house music Detroit indirectly influenced individual
progressive electro house, extended miami rave mixed club higher alive acid together lose bounce lights disco blow bang stars find found control drop 
mexican hip hop, locos seguimos barrio puro cypher quieren calle mexicano volando humo hijos andamos calles ellos sigo perros xico malo zona estamos Mexican hip hop hip hop music Mexico hip hop music performed Mexican artists artists Mexican
heartland rock, band nothin' interview american highway lovin' hearts talk won't lucky johnny rockin' ballad brand guitar straight woman inside nobody help Heartland rock genre rock music characterized roots musical focus conviction rock music social communal purpose genre exemplified Tom Bob Bruce Springsteen John Mellencamp country music including Steve Earle Joe The genre developed reached commercial peak genres United In established acts faded genre began major figures continued record commercial
roots rock, nashville highway band ballad thirty railroad helpless interview poor betty alabama takes drivin' lonesome wreck knockin' bluebird border train crossroads Roots rock genre rock music looks origins blues country It particularly associated creation hybrid subgenres later including blues country Southern swamp rock seen responses perceived excesses dominant psychedelic developing progressive Because roots music mean folk world musical roots rock broad sense describe rock music incorporates elements In roots rock enjoyed revival response trends punk new heavy metal saw new interest One proof specific Grammy Award given notably Jon Batiste According trophy defined category recognizes excellence blues folk recordings modern traditional vocal instrumental original material artists use traditional modern roots sounds instrumental techniques basis
pagode, jeito pourri deixa samba minha coisa pout quem nossa paix sorriso beijo quero nosso nega cora gostoso brilho sonho tudo Pagode Brazilian style music originated Rio de subgenre Pagode originally meant celebration In singer Beth Carvalho introduced liked recorded tracks Zeca Pagodinho Over pagode commercial included version music filled sentiment term pejorative commercial pop Pagode pagode developed beginning advent band Fundo de Quintal introduction new instruments classical samba Pagode lyricism represented kind evolution tradition malicious ironic samba heavier use slang underground introduction credited Almir different louder sound loudness advantage acoustic environments percussion instruments people singing The banjo characteristic instruments pagode introduction credited dynamic type main beat played introduction credited percussive instrument specially rhythmic
lounge, charade baia happened gigi ev'ry frenesi orchids continental bali tenderly bewitched malaguena nearness brazil fascination april misirlou wives begin you'd Lounge music type easy listening music popular It meant evoke listeners feeling usually tranquil island paradise outer The range lounge music encompasses beautiful modern electronica downtempo remaining thematically focused age cultural The earliest type lounge music appeared known light
folk-pop, gold these trouble coming musical style contemporary folk songs sweeping pop pop songs folk Recording production values created unblemished style appealed mass led commercial success measured high record particularly illustrated hit records reaching Top AM radio United developed folk music folk rock Key example artists include The Kingston Trio Paul Mary contracts major record labels Records Warner Brothers The commercially successful artists stood contrast politically charged uncompromising folk music performers Joan Barbara Phil Nina Simone The recent decades Tracy Chapman Ani found regions
nigerian pop, chop duro balance hustle african flex champion skit body problem number baba vibe nobody fine ghetto energy story pray bless 
classical, tchaikovsky sannonce annonce debussy schubert entered viii beethoven strauss schumann konzert quatuor allegro allegretto mozart andante andantino scherzo arie symphonie Classical music generally refers art music Western considered distinct Western folk music popular music It distinguished Western classical term applies art Classical music characterized formality complexity musical form harmonic particularly use Since ninth century primarily written spawning sophisticated notational accompanying literature musicological philosophical A foundational component Western classical music frequently seen perspective individual groups personalities beliefs fundamentally shaped patronage churches royal courts Western early medieval music chiefly monophonic music ancient Greece Rome influencing thought The earliest extant music manuscripts date Carolingian Empire time Western plainchant gradually unified termed Gregorian Musical centers existed Abbey Saint Abbey Saint Martial Saint century saw development staff notation increasing output medieval music By century France major European musical religious school fully explored organized rhythms secular music flourished troubadour trouvère traditions led This culminated court sponsored French ars nova Italian evolved ars stylistic movement extreme rhythmic Beginning early Renaissance composers influential School built harmonic principles English contenance bringing choral music new particularly mass Northern Italy soon emerged central musical Roman School engaged highly sophisticated methods polyphony genres inspired brief English Madrigal Baroque period saw relative standardization increasing importance musical grew ensembles considerable Italy remained birthplace soloist centered concerto organized sonata form large scale genres oratorio The fugue technique championed Johann Sebastian Bach exemplified Baroque tendency reaction simpler galant music empfindsamkeit styles In shorter pivotal Classical period composers Wolfgang Amadeus Joseph Ludwig van Beethoven created widely admired representatives absolute including string quartets The subsequent Romantic music focused instead programmatic art symphonic poem piano genres important During time virtuosity immensity philosophy nationalism aspects converged operas Richard By stylistic unification gradually dissipated prominence popular music greatly Many composers actively avoided past techniques genres lens abandoning tonality place found new inspiration folk melodies impressionist After World War time audience members valued older music contemporary preference catered emergence widespread availability commercial Trends century present day include New New Spectral recently Postmodern music Increasingly practitioners Africa Asia obtained crucial symphony orchestras opera houses appear
polish hip hop, jestem nowy jest wszystko wiat nigdy challenge ostatni ycie zawsze miasto mnie wiem tylko gdzie dzieci kiedy powiedz pierwszy chcia The Polish hip hop scene born early popularity American rap style Polish music deep roots Polish punk alternative disco funk artists performers especially Eastern Many rappers Poland collaborating artists USA
dance rock, much running genre rock It genre connected pop rock fewer rhythm blues It originated early following decline popularity punk early include Gina Russ artists Dinosaur Liquid Liquid compilation album Disco Not
hollywood, finale overture prologue goes maybe funny once goodnight loved opening send there's you'll somewhere myself children anything someone everybody santa Hollywood usually refers Los neighborhood metonym major studio system American cinemaHollywood refer
worship, reigns performance exalted worthy faithful redeemer hosanna unto majesty christ lift able arise lamb jesus praise glory grace saviour holy Contemporary worship music known praise worship defined genre Christian music contemporary It developed past years stylistically similar pop The songs frequently referred typically led guitarist pianist It common genre music sung particularly charismatic Protestant churches Roman Catholic congregations incorporating mass
escape room, bitch fuck pussy pink drop mine shit body self queen boys super gold sick everybody been face kill girls full An escape known escape puzzle exit game team players discover solve accomplish tasks rooms order accomplish specific goal limited The goal escape site Most escape games cooperative competitive variants Escape rooms popular North East Asia Permanent escape rooms fixed locations opened Asia followed later New South
tamil pop, kadhal naan anbe ennai unnai enna chinna amma nila kanna aayiram yaaro muthu malai muruga saranam naal neela prema sundari 
uk hip hop, daily bars trap about freestyle flex warning london gang different block drip style dont doing skit smoke aint cash murder British hip known UK hip hop UK genre culture covers variety styles hip hop music United It generally classified number styles British hip hop referred term coined popularised mainly British Vogue magazine British hip hop originally influenced introduced United Kingdom Jamaican migrants eventually developed uniquely influenced rapping order match rhythm pace aggression dub Toasting soundsystem cultures influential genres outside hip hop included rapping UK The Times described British hip broad sonic encompassing Britain musicians informed inspired music response stimuli gave birth rap New York
glam metal, generation guitar wasted hell slave drum shoot scream fallen dirty livin' piece shot shout rebel danger boys tear line american Glam metal known hair metal pop subgenre heavy metal features hooks guitar upbeat rock slow power It borrows heavily fashion image glam glam metal evolved directly glam rock movement visual elements taken acts New York David Bowie lesser punk new wave movements taking place concurrently New York fused decidedly heavy metal leaning theatrical acts Alice Cooper The examples fusion began appearing late early United particularly Los Angeles Sunset Strip music Early glam metal bands include Mötley Hanoi Quiet Twisted Bon Glam metal achieved significant commercial success approximately bringing prominence bands Skid Cinderella From strictly visual glam metal defined flashy overall androgynous aesthetic traditional aspect heavy metal culture replaced usually heavy use bright metal suffered decline popularity grunge alternative phenomena revolutionized hard tastes moved natural aesthetic rejection glam metal visual During successful acts pinnacle suddenly found facing disbandment audiences moved Glam metal experienced resurgence late successful reunion tours popular acts emergence predominantly European including Reckless American band Steel
indie r&b, company worth flowers pressure yours mine late talk feelings energy stuck gold same feels enough pink garden nobody mood sunset 
christian music, performance forgiven redeemer faithful maker jesus lift grace holy lead worthy savior unto majesty emmanuel greater fill glory exalted revival Christian music music written express personal communal belief Christian life Common themes Christian music include forms vary widely Church gospel worship music Christian include contemporary Christian music supports numerous Christian styles including hip contemporary forms music definition Christian music varies according culture social Christian music composed performed ranging aesthetic religious ceremonial positive message entertainment product
chill r&b, mine stuck maybe friends wait won't sorry talk same late without 
french pop, mots comme quand l'amour elle tout j'ai celui nous viens plus vivre fille veux rien quoi suis tais laisse l'homme French pop music pop music sung French It usually performed singers francophone areas The target audience francophone market considerably smaller largely independent mainstream anglophone
j-rock, album size sayonara tokyo answer acoustic single version anniversary dive milk studio monster super fish demo boys flower yeah opening Japanese rock Nihon abbreviated Jei rock music Influenced American British rock rock bands Japan performed called Group lyrics exclusively Folk rock band Happy End early credited sing rock music Japanese Punk rock bands Boøwy The Blue Hearts hard metal groups X Japan led Japanese rock late early achieving major mainstream bands Children best selling music acts Rock festivals like Fuji Rock Festival introduced late attendances reaching peak people festival making largest outdoor music event
