genre,definition
yacht rock, band york fool should someone change woman full you've american through gotta we're there's looking without save cool people talk Yacht rock known West Coast sound broad music style aesthetic commonly associated soft commercially successful genres Drawing sources smooth smooth common stylistic traits include clean focus catchy Its coined makers online video series Yacht derived association popular Southern Californian leisure activity
soundtrack, credits titles reunited hospital aftermath accident helicopter following rooftop meeting ambush reunion betrayal entering finding arrival pursuit training raid returning A soundtrack recorded music accompanying synchronised images motion television radio video commercially released soundtrack album music featured soundtrack television physical area film contains synchronised recorded movie industry terminology sound track audio recording created film production sound music film separate track sound effects music mixed called composite heard A dubbing track later created films dubbed This known tracks contain sound elements minus supplied foreign distributor native language dictionary entries soundtrack document soundtrack An early attempt popularizing term printed magazine Photoplay A technical dictionary entry Academic Press Dictionary Science Technology distinguish form sound track contraction soundtrack came public consciousness advent late First conceived movie companies promotional gimmick new commercially available recordings labeled advertised original motion picture inspired motion These phrases soon shortened motion picture More recordings music usually consist isolated music composite track dialogue sound abbreviation OST describe musical soundtrack recorded stands Original differentiate original music heard recorded versus rerecording
contemporary r&b, thinkin' sexual spend sexy fallin' special gotta grown whatever lovin' anything everytime giving ghetto love's without treat should sorry lose 
pop nacional, mais tudo tempo deixa quero quem vivo quando nada 
italian adult pop, l'amore giorno mondo siamo cuore tutto adesso sono cose anche senza ancora quello l'uomo ragazzo voglio vita qualcosa domani niente 
grupera, quisieras tonto lastima juguete brindo carino chiquitita chiquilla llorar pero acordar llorando quise porque herida pienso vayas vuelve amargo stima Grupera known Grupero Onda genre Regional Mexican It reached height popularity especially rural The music roots rock groups today generally consists musicians electric keyboards The music increased popularity commercially recognized Latin music awards ceremonies Lo Nuestro The Latin Grammy Grupero artists typically perform boleros
mariachi, guadalajara jarabe dejan anitas xico golondrinas cielito culebra fallaste amanec huapango tristes derrota diferencia gabino barca bonito sinaloense enorme cascabel Mariachi genre regional Mexican music dates evolving time countryside regions western The usual mariachi group today consists trumpets including vihuela acoustic bass guitar called players taking turns singing lead backup migrations rural areas Mexican cultural promotion gradually son alternative mariachi Modifications music include influences music polkas addition trumpets use charro outfits mariachi The musical style began national prominence half promotion presidential inaugurations radio In UNESCO recognized mariachi Intangible Cultural joining entries Mexican list styles instrumentals performed mariachi include waltzes Most song lyrics revolutionary heroes country
lo-fi beats, haze pastel wander bloom fireflies blossom daydreaming childhood sunflower lavender bliss leaves places coffee backyard cozy dusty dusk skyline seaside 
funk metal, shot save Funk metal known subgenre funk rock alternative metal infuses heavy metal music thrash elements funk punk Funk metal alternative metal described extremely stylistic funk metal scene formed California group bands initially playing mix hard hip hop quickly evolved include elements thrash Early bands associated style included Faith No Fishbone Red Hot Chili New York band Living In early genre expanded start bands like Infectious Grooves Rage Against Funk metal gained mainstream attention late Living Colour Faith No More experienced chart success Bands including Rage Against Primus Red Hot Chili Peppers achieved success early The genre impact glam metal thrash metal bands genres began adding funk elements sound Despite rise newer artists genre decline end bands early begun breaking moving Funk metal paved way nu metal movement late influential acts Korn Limp
alternative dance, modern silence half eyes beat lights golden control closer kiss girls move heavy running leave stars future wrong shake walking Alternative dance known indie dance underground dance musical genre mixes alternative rock electronic dance Although largely confined British gained American worldwide exposure acts New Order Prodigy
dirty south rap, chopped screwed speaks swang pimp throwed hood shawty gangsta gettin crunk ballin ridin screw grind haters comin smokin talkin hustle 
rap conscient, elle monde dernier dans fait rien tout sans j'ai pour nous fais mort plus coeur laisse faut comme temps c'est 
vocal jazz, ev'ry nearness bewitched concentrate skylark detour lamp cheek you'd straighten porgy cottage darn insensitive exactly folks gentleman deed isn't what'll Vocal jazz jazz singing instrumental approach jazz Similar utilizes vocal arrangements create sounds forming relying traditional musical jazz emerged early twentieth roots Popular blues singers Bessie Smith Ma Rainey great deal influence jazz vocalists Billie Other characteristics vocal jazz scat singing came New Orleans jazz Louis recording cited modern song employ This later evolved complex vocal improvisation bop era adopted Anita Sarah Betty Dizzy The Boswell Sisters vocal jazz trio originating New Orleans help popularize vocal jazz music general American public vocal jazz typically includes music Great American contemporary popular music arranged vocal jazz ensembles addition original Such music typically employ harmonic language rhythms derived syncretized music West European Art Music This includes swing Latin jazz rhythm characteristics vocal jazz include diction based vernacular formal speech Legato vibrato constants articulation vocal Vocal jazz uses microphone amplification singers accompanied rhythm section vocal
brazilian rock, amanh tudo mais mesmo vivo pouco medo stico quase tempestade quando ncio vezes enquanto perto talvez homem quem dias tempo Brazilian rock refers rock music produced Brazil usually sung In known Portuguese transcription line Beatles song Loves
queens hip hop, thug hood gangsta york shot shit skit murder freestyle street bonus ghetto check streets watch fuck straight talk gotta move 
pop r&b, selfish freaky toxic switch freak feelings body fuck talk trust favorite diamonds mine different pressure been sexy truth nobody side 
salsa, guaguanc guaguanco descarga cantante guajira tuyo sabroso montuno pa'l loma bomba pachanga rumba plena cuba palo colombia mujer arroz yolanda Salsa music style Latin American Because basic musical components predate labeling controversies Most songs considered salsa primarily based son elements Latin plena All elements adapted fit basic son montuno template performed context salsa label commercially styles Latin dance nowadays considered musical style staples Latin American salsa bands predominantly assembled Cuban Puerto Rican musicians New York City The music style based late son montuno Arsenio Conjunto Chappottín Roberto These musicians included Celia Rubén Johnny Machito Héctor period parallel modernization Cuban son developed Los Van NG La Charanga Habanera artists Cuba songo styles present labelled Though limited continuous cultural exchange musicians inside outside Cuba
classic soul, glad since sweeter we've you've thankful gonna gotta loving didn't found hooked sure share must woman hurt cause proud everybody Classic soul radio format focuses raw types soul music draw certain rhythm blues soul music generally considered smoother sophisticated split indicated Michael album Off considered sit nexus classic contemporary
modern country rock, beer drinkin' workin' whiskey dirt drink honky cowboy damn drunk livin' didn't american kiss hell santa small about gonna holy 
christian alternative rock, performance majesty jesus lead holy lift savior grace faithful salvation greater glory glorious draw hallelujah hark revival arise unto yours Christian alternative rock form alternative rock music lyrically grounded Christian Some critics suggested unlike CCM older Christian Christian alternative rock generally emphasizes musical style lyrical content defining genre degree faith appears music varies artist
rock-and-roll, what'd pledging lula rockabilly twistin' hound stagger diddley lawdy that'll rockin' remastered babe blueberry gonna kansas corrine lonesome walkin' twist Rock roll written rock rock rock genre popular music evolved United States late early It originated music rhythm boogie country While rock formative elements heard blues records country records genre acquire journalist Greg refers style popular music originating United States By rock roll developed encompassing international style known rock continued known circles rock For purpose article deals earliest rock roll piano saxophone typically lead These instruments generally replaced supplemented guitar middle late The beat essentially dance rhythm accentuated provided snare Classic rock roll usually played electric guitars double bass After electric bass guitars drum kits popular classic roll polarizing influence It portrayed fan Some people believe music positive influence civil rights Black American White American teenagers enjoyed
cantautor, directo barcelona canci tinc vull quan lluna abril sota madrid nana nadal palabras tren cancion balada avui salir hombre veces 
cali rap, facts hella shit livin bitch trippin neva bands nigga tryna niggas gang gettin risk playin ratchet bars turnt thang slide 
eurodance, megamix extended club rhythm planet move gimme sexy boom everybody bounce touch around hands because follow rainbow alive jump dreams Eurodance referred genre electronic dance music originated late It combines elements hip house Euro This genre music heavily influenced use rich rapped combined strong bass rhythm melodic establishes core foundation Eurodance
mexican rock, fantasma despierta hasta veneno nada lobo miedo ciudad hombre sombras tiempo otra siento vivo lejos horas dolor cada puedo perro Mexican rock referred Mexico rock nacional originated Standards The Elvis The Everly Nancy Chuck Berry soon covered bands Los Los Teen Los Los Los Los Los Rebeldes del Los Locos del Los Crazy Javier later led original The group racially integrated band Their lead Bill Aken son Lupe effectively making Aken cousin Ritchie wrote original including raucous material Sounds Of The Barrio Their recording My Babe recording Latino In southwestern United Spanish guitar rhythms Mexican musical influences inspired music American musicians Ritchie Danny Flores The Sam Roy Herb public exhibited moderate interest media attention focused La Ola Inglesa substantial success guitarist Carlos Santana United States late successful development counterculture movement called La Onda bands sprang Most bands sang Spanish keeping foreign commercial exposure Mexican Chicano rock crossed Hispanic groups like José Feliciano Lourdes Puerto Rican
beatlesque, words really tomorrow looking maybe woman about were dear gonna won't mother much again thank other without there's pretty save describes musical resemblance English rock band The term loosely defined applied inconsistently wide variety disparate
british invasion, what'd mono you've babe memphis gonna funny really johnny interview crying you'll woman yesterday fool many send summertime loving honey The British Invasion cultural phenomenon rock pop music acts United Kingdom aspects British culture popular United States significant rising sides Atlantic Pop rock groups Rolling Small Dave Clark Gerry Who solo singers like Dusty Cilla Petula Tom Jones forefront
dream pop, everyone untitled half driving crash glass strange dust pink through drive words silver lazy inside golden spanish queen silence stars Dream pop typeset subgenre alternative rock emphasizes atmosphere sonic texture pop Common characteristics include breathy dense effects It overlaps related genre genre terms times genre came prominence work groups Cocteau Twins acts My Bloody Galaxie Julee Mazzy Star released significant albums It saw renewed popularity millennial listeners following success Beach
mandopop, demo opening acoustic version sorry super medley kiss about dear Mandopop Mandapop refers Mandarin popular The genre origin popular music Shanghai known later influences coming Japanese Hong Hokkien particular Campus Song folk movement general term describe popular songs performed Though Mandopop predates English term coined popular term describing popular songs describe popular songs versions Cantopop songs sung singers different lyrics suit different rhyme tonal patterns categorized subgenre commercial music Popular music sung Mandarin variety popular music Chinese establish viable It originated later Hong Taipei Beijing emerged important centers Mandopop music Among regions countries Mandopop popular mainland Hong South Singapore
melancholia, sister half bird interview were snow untitled queen stars ballad mother sometimes paper leaving sleeping before west there's john send Melancholia melancholy µέλαινα χολή melaina meaning black concept found medieval premodern medicine Europe describes condition characterized markedly depressed bodily hallucinations regarded temperaments matching Until doctors scholars classified melancholic conditions perceived common cause excess notional fluid known commonly linked late late melancholia common medical modern concepts depression mood disorder eventually arose historical concepts historical medicine Latin Latin fastidious obsolete English Latin influence planet
world worship, yesus jezus hosanna emmanuel exalted worthy christ tuhan jesus faithful praise saviour gloire wees majesty unto bapa psalm reigns abba 
forro, vaqueiro solteiro saudade cora xote abertura jeito amei galera volta mulher bebo beber liga acho anjo quero tome beijo valeu The word forro refer Forro ethnic group São Tomé Forro spoken style music dance northeastern Brazil
new americana, ohio colorado tennessee wolves whiskey bones ballad strangers highway mississippi mountain lonesome john trouble california poor southern bird train south 
emo, worst everyone twenty untitled dying most carry second even wait empty fake small hate reason secret head kill paper sick Emo rock music genre characterized confessional It emerged style hardcore punk Washington hardcore punk known emotional hardcore emocore pioneered bands Rites Spring In emo adopted reinvented alternative indie rock punk rock bands Sunny Day Real Jimmy Eat By bands Promise Get Up Kids emerged burgeoning Midwest emo independent record labels began specialize aggressive style emo screamed pioneered San Diego bands Heroin Antioch Screamo achieved mainstream success bands like Hawthorne Story seen emo signifies specific relationship fans artists certain aspects culture Emo fashion associated skinny black tight band studded hair long Since early mid fans emo music dress like referred known listening bands like My Chemical Fall Out Hawthorne The The emo subculture stereotypically associated social introversion Purported links combined rise popularity early inspired backlash bands My Chemical Romance Disco rejecting emo label social stigma controversy surrounding subgenre emo pop entered mainstream culture early success Jimmy Eat World Dashboard Confessional artists signed major record Bands My Chemical Fall Out Boy Red Jumpsuit Apparatus continued popularity rest By early popularity groups changing sound mainly underground emo revival bands The World Is Beautiful Place I Am No Longer Afraid Die Modern drawing sound aesthetic During late fusion genre called emo rap emo famous artists including Lil XXXTentacion Juice
dfw rap, trap shit gang hood smoke whole fuck work gotta talk street 
atl trap, dawg racks dope plug drip hood rich niggas cash shit damn nigga ball block pull gang freestyle fuck bout fake 
melodic metalcore, sleepless hollow oblivion strength false buried misery bleed grave bitter ashes void enemy hell beneath skin rise year dying awakening Melodic metalcore fusion incorporating elements melodic death metal heavy emphasis melodic distorted guitar palm double bass blast aggressive death clean The genre seen commercial success employing accessible sound times compared forms extreme Many notable melodic metalcore bands influenced At Gates In
trap queen, bitch juice nasty bitches booty boss fuck cash gucci drip shit freestyle pussy freak pressure talk check throw rich broke 
brostep, drop kill move head Dubstep genre electronic dance music originated South London early The style emerged UK garage offshoot blended rhythms sparse dub incorporating elements broken drum In United origins genre traced growth Jamaican sound system party scene early generally characterised use syncopated rhythmic prominent dark In underground sound strains garage music began showcased promoted night club Plastic night stylised pirate radio station Rinse went considerably influential development The term reference genre music began labels Big time stylistic trends remixes noticeable distinct early supporter sound BBC Radio DJ John started playing In year listeners voted Digital Plastician Dubstep started enter mainstream British popular culture spread small local scenes late early websites devoted genre appeared Internet aided growth download site Barefiles blogs genre receiving extensive coverage music magazines The Wire online publications regular feature entitled The Month Interest dubstep grew significantly BBC Radio DJ Mary Anne Hobbs started championing beginning devoted January end early genre started commercially successful singles remixes entering music Music journalists critics noticed dubstep influence pop Around producers began fuse elements original dubstep sound creating fusion genres including future garage slower experimental The harsher heavy variant led American producers greatly contributed popularity United
g funk, gangsta cali pimp niggaz thug ghetto killa hood west nigga niggas murder game playa streets block skit throw dope straight short gangsta gangsta rap emerged West Coast scene late The genre heavily influenced psychedelic funk sound artists
sad lo-fi, scars imagination losing numb hurt would afraid feelings hate trust tired thought sorry feeling stuck late used hope missing memories 
orchestral soundtrack, reunited rooftop titles credits betrayal returning helicopter arrival airport training showdown aftermath following meeting ambush entering cemetery finding duel homecoming 
russian hip hop, prod bonus skit acoustic trap freestyle fuck Russian hip hop refers hip hop music recorded Russia Russian language Soviet states like Hits Russian rappers included soundtracks formed popular internet Russian rap artists achieved commercial including Bad Oxxxymiron Belarusian artist end beginning rap political form music In rap compared rock gave voice young people critical Soviet Viktor Khochu peremen want increased politicization impressively demonstrated end string concerts Among performance rapper Khaski Dmitry Krasnodar end After local office banned performing Club Bounce grounds music contained extremist drug glorification rapper stood roof car began singing fans street police took away leading initially sentenced days As famous rappers gave solidarity concert
rockabilly, lula rockin' what'd matchbox pledging hound slippin' twistin' honky lawdy diddley lonesome rockin gonna jambalaya stagger sixteen teenage tennessee lucille Rockabilly earliest styles rock roll It dates early United especially As genre blends sound Western musical styles country rhythm leading considered rock Some described blend bluegrass rock The term portmanteau reference country music called contributed strongly Other important influences rockabilly include western jump electric features rockabilly sound included strong boogie woogie piano vocal acapella common use tape progressive addition different instruments vocal harmonies led Initially popularized artists Carl Elvis Johnny Jerry Lee Ricky rockabilly style waned late late early rockabilly enjoyed An interest genre endures musical Rockabilly spawned variety influenced development genres punk
brooklyn drill, shit different talk Brooklyn drill regional subgenre drill centered New began derivative drill music scene Chicago later derivative UK drill percussion sliding notes producers UK drill Brooklyn drill emerged single rapper Bobby Other early pioneers rappers Rowdy Bam Money Dah Dah Curly It popular mainstream late Pop With success mixtapes Meet Woo Meet Woo Pop Smoke introduced Brooklyn drill mainstream music Other notable Brooklyn drill artists include Fivio Sheff Sleepy Dusty
new french touch, horizon sunset waves control memories golden lights paradise ocean close move 
otacore, megalovania silhouette dearly pokemon kimi dearest sadness dragon spark resolution despair hero courage lavender swan rumbling inferno butter spider battle 
bachata, enamore muero duele puedo homenaje vuelve dile llora dame necesito dime veneno ella mujer mujeres eres pero porque corazon estoy Bachata refer genre Latin American subgenre bachata dance style Dominican hybrid music song Lou Bega
screamo, bury bleed untitled dying playing hell voices burn kill those most american letter we're empty friends sound shadows second wake Screamo referred aggressive subgenre emo emerged early emphasizes experimental dissonance San bands Heroin Antioch Arrow pioneered genre early developed late mainly bands East Coast United States Funeral I Hate Screamo strongly influenced hardcore punk characterized use screamed Lyrical themes usually include emotional human The term frequently mistaken referring music screaming experienced popularity success bands like Hawthorne Senses The popularity declined continued underground success bands like Dispute Pianos Become
country pop, drinkin' drink beer whiskey dirt drunk cowboy damn boys american heartbreak small nothin' southern acoustic tennessee hell livin' girls middle Country pop known pop country urban fusion genre country music pop music developed members country genre desire reach mainstream Country pop music blends genres like continuing similar efforts began late known originally Nashville sound later By country artists transitioning led charting high mainstream Billboard country pop easy listening artists crossed country charts After declining popularity neotraditional movement country pop comeback sound drew heavily pop rock adult
kleine hoerspiel, kapitel teil geheimnis reise falsche neue weihnachten wilde freunde kleiner endlich erste schlaf gute feuer drei kommt nach alte wird 
symphonic rock, drum introduction watching remaster fanfare overture epilogue prelude book mystery prologue guitar part wings flight doctor america band hymn second Progressive rock prog rock simply conflated art broad genre rock music developed United Kingdom United States late peaking early Initially termed style outgrowth psychedelic bands abandoned standard pop traditions favour instrumentation compositional techniques frequently associated classical Additional elements contributed lyrics technology harnessed new music approached condition focus musical involved creating music listening rock based fusions approaches involving continuous formalism Due historical scope progressive rock limited stereotype long long fantasy grandiose stage sets obsessive dedication technical While genre cited merging high culture low artists incorporated literal classical themes work great handful Lake purposely emulated referenced classical genre coincided economic boom allowed record labels allocate creative control new journalistic division lent generic significance It saw high level popularity faded soon Conventional wisdom holds rise punk rock caused factors contributed Music labelled concepts sounds tended hostile genre completely ignore After late progressive rock fragmented numerous Some bands achieved commercial success changed lineups compact song crossed symphonic arena new groups exhibited progressive features retroactively described The Canterbury originating late denotes subset progressive rock bands emphasised use wind complex chord changes long Rock late combined Canterbury created In new enjoyed commercial accused derivative lacking draws newer developments popular music
turkish rock, beni yaln belki hayat zaman mavi geldin nler gece sarho bana yollar gibi sorma amak deli masal seni senden sensiz Anatolian rock Anadolu known Turkish psychedelic fusion Turkish folk music It emerged soon rock groups popular Most known members genre includes Turkish musicians Barış Cem Erkin Selda Fikret Kızılok alongside bands Kurtalan Ekspres
florida rap, shit thug pressure trap fuck pray letter street freestyle pain been trust drop talk play smoke same 
