genre,definition
banda, sabiendo sinaloense botellas toro corrido tragos muchacho palomas vergelitos popurr pasadita cosecha ausente fortuna lamberto ranchero carga borracho cerro entierren Banda genre Regional Mexican music musical ensemble wind brass history banda music Mexico dates middle century arrival piston metal community musicians tried imitate military The bandas formed Southern Central In village different certain types brass
post-grunge, acoustic sick save burn without these hell devil inside fight hate days somebody same running made leave stand head change derivative grunge abrasive intense tone traditional term pejoratively label rock bands Candlebox Collective Soul emulated original sound late morphed clearly defined style married sound aesthetic grunge intense abrasive rising prominence lasted Bands Foo Puddle Breaking Three Days Collective Matchbox Nickelback achieved mainstream
sertanejo pop, cora saudade beijo beber precisa bebo vivo quem hoje solteiro dois ainda cheiro conta esquecer querendo copo erro cuida imagina 
new wave, remaster demo tomorrow's flesh satellite pleasure single boys private strange doesn't skin century kiss monkey burning flame sister watching being New wave loosely defined music genre encompasses styles late It originally styles music emerged punk including punk critical consensus favored umbrella term involving popular music styles including power ska specific forms punk rock It viewed accessible counterpart characteristics new wave music include humorous quirky pop use electronic distinctive visual style music videos In early virtually new act particularly employed synthesizers tagged Although new wave shares artists influenced styles lighter strains pop opposed generally political bents punk considered creatively stagnant wave commercially peaked late early numerous major artists abundance launched heavily promoted boosting In new wave declined emergence New New New Music Since new wave resurged times growing nostalgia
sierreno, escuela humilde caro andamos compa muchacho ayudante cholo gustas compro comandante corrido manuel estilo dicen doble vivo clave bueno cada 
k-pop girl group, inst japanese moonlight kiss dear secret star 
pop punk, worst letters anywhere bury losing kids acoustic playing friends sick empty wasted chasing truth american hate we're here's until twenty rock music genre combines elements punk rock power pop It defined emphasis classic pop adolescent distinguished genres drawing heavily bands Beach The genre evolved absorbing elements new college boy It considered interchangeable power pop skate emerged late groups punk bands like Bad Descendents Misfits influential pop pop punk expanded early host bands signed including Screeching T In genre saw massive widespread popularity increase bands like Green Offspring The genre popularized Warped success continued early artists Avril Sum Good Charlotte New Found acts largely indistinguishable artists tagged extent emo crossover acts Fall Out Boy Paramore popularized style dubbed emo By mainstream popularity rock bands music rare pop In late early new crop music began experiencing mainstream resurgence new acts Machine Gun KennyHoopla
canadian hip hop, problems drip paid freestyle gang stick diamonds demons pull different trap rich myself trust dope talk made hood pain fast The Canadian hip hop scene established Through variety developed slower popular rock music apart burst mainstream popularity remained largely underground phenomenon early hip hop artists right early days known Canadian rap released weeks The Sugarhill historic French rap Lucien released For infrastructure music overlooked Canadian music historians instead media reference works erroneously credited Singing Bum released years later Canadian rap Even Canadian hip hop artist signed record difficult widespread Even music videos played artists records stores played Canadian hip hop artists broke mainstream success acts Maestro Main Dream Warriors gained recognition internationally underground hip hop following decade Canadian hip hop acts experienced slowdown significant artists breaking No Canadian hip hop songs reached Top Canadian pop charts Beginning sequence events spurred anthemic collaborative single finally brought hip hop mainstream Canadian propensity create quality artists rarely achieved public recognition prompted AllMusic writer Jon Azpiri state Canadian hip hop secret
indie folk, ohio evergreen bones bird salt silver wolves trouble gold strangers traveling maybe weather middle bullet california dust bright hollow weight Indie folk music genre arose musicians indie rock scenes influenced folk Indie folk hybridizes acoustic guitar melodies traditional folk music contemporary genre earliest origins folk artists displayed alternative rock influences Ani DiFranco Dan acoustic artists Elliott Smith Will In following labels Saddle Sub Pop helped provide support indie artists Fleet Foxes breaking pop charts albums Helplessness United artists Ben Howard Mumford Sons band promoting music style Gentlemen Road touring The success acts like Mumford Sons led music journalists like Peter Robinson labelling new British music scene The New Boring Beige late artists Phoebe Bridgers Julien Baker revived interest Bridgers cites Elliott Smith foundational influence
viral pop, titanium roar happier radioactive wrecking firework photograph mirrors iris shape dynamite fireflies scientist blank acoustic issues habits boyfriend meant havana 
conscious hip hop, y'all ghetto word freestyle hood street state message skit game fuck people letter speak murder shit kill freedom gotta self Political hip hop subgenre hip hop music developed way turning hip hop political social action form social political Inspired political artists The Last Poets musician Gil Public Enemy predominantly political The genre helped create new form social expression subordinate groups speak injustices lack Political use hip hop music send political messages inspire action social change convince listener particular There political multiple perspectives range anarchism Marxism values
indonesian pop, cinta tentang kamu takkan bukan jangan bisa selalu sampai jatuh karena seperti sahabat satu sendiri pernah teman tetap yang ingin Pop known Indonesian pop loosely defined Indonesian pop wider sense encompass Indonesian pop includes Indonesian cinema sinetrons TV pop music today influenced trends recordings West return Indonesian style pop music influenced regional pop culture Southeast especially Malaysian pop scene began imitating Indonesian style pop music late Indo pop usually expresses contemporary Indonesian sentiments generally love social life related music sad mellow melodies popular selling
stomp and holler, ohio older crooked wolves virginia bones wandering silver gold ghosts common southern salt carry year california wait window arms paper 
blues rock, hoochie spoonful mojo catfish howlin' smokestack goin' crossroads hurts messin' highway driftin' voodoo rollin' leavin' babe tore guitar band further Blues rock fusion music genre combines elements blues rock It electric music instrumentation similar electric blues rock electric bass keyboards From beginnings early blues rock gone stylistic shifts way inspired influenced hard Southern early heavy rock started rock musicians United Kingdom United States performing American blues They typically recreated electric Chicago blues Willie Muddy Jimmy faster tempos aggressive sound common In style popularized groups Rolling blues songs pop In Lonnie Paul Butterfield Blues Canned Heat earliest Some bands played involved improvisations commonplace jazz In late early style hard In Johnny early Allman Brothers ZZ Top represented hard rock Ten Years Savoy Foghat traditional blues styles influenced blues continues return Along hard blues rock songs core music played rock radio United later classic rock format established
italian hip hop, fuori tutto niente nessuno testa meglio ragazzi sogni nuovo senza anni sono miei milano quello qualcosa cosa ancora bene fino Italian hip hop started One hip hop crews catch attention Italian mainstream Isola Posse All today produced Sandro written soundtrack animated TV series Signor Rossi The European Music report Music Europe claimed hip hop south Italy tends harder
australian pop, hearts acoustic won't maybe jealous leave ordinary wasted golden breathe coming used sorry amazing drive alright friends somewhere girls runaway 
bedroom pop, maybe talk typeset lofi short low music production quality elements usually regarded imperfections context recording performance deliberate The standards sound quality music production evolved meaning older examples originally recognized began recognized style popular music alternately referred DIY music distortion confused core features characterized inclusion elements normally viewed undesirable professional misplayed environmental phonographic imperfections audio tape significant artists include Beach Boys Smile Wild Stevie Moore called godfather home Paul McCartney Todd Daniel Guided Ariel cultural lexicon approximately long WFMU disc jockey William Berger usually credited popularizing term At points connected cassette DIY ethos outsider X cultural The notion musicians expanded following rise modern digital audio late aesthetics served basis chillwave hypnagogic pop music
corridos tumbados, iniciales guero escuela pacas andamos vago compa chino estilo gordo equipo cholo junior calles dicen javier sigo ivan clave ando 
disco, betcha love's dancin' megamix lovin' you've boogie he's medley we've gonna gotta share really we're reach single sure loving funky Disco genre dance music subculture emerged United urban nightlife Its sound typified syncopated string electric electric rhythm started mixture music venues popular Italian Hispanic Latino Americans Black Americans Philadelphia New York City late early Disco seen reaction counterculture dominance rock music stigmatization dance music Several dance styles developed period popularity United including course disco music developed mainly artists United States artists Bee Donna Gloria Giorgio Boney Earth Wind Chaka KC Sunshine Thelma Sister The Trammps Village While performers garnered public record producers working scenes played important role developing By late major cities thriving disco club DJs mix dance records clubs Studio venue popular wore extravagant consisting predominantly flowing pants dresses ease movement There thriving drug subculture disco particularly drugs enhance experience dancing loud music flashing cocaine common disco subculture nicknamed Disco clubs associated promiscuity reflection sexual revolution era popular Films Saturday Night Fever Thank God Friday contributed mainstream declined major trend popular music United States following infamous Disco Demolition continued sharply decline popularity early remained popular Italy European countries time started trendy places including India Middle blended regional folk styles ghazals belly Disco eventually key influence development electronic dance house hip new The style newer scenes influence disco remains strong American European pop A current revival underway early coming great popularity early Albums contributed revival include Confessions On A Dance Random Access The Slow Cuz I Love Future Hey U Your About Last Róisín Kylie album titled
spanish pop, directo madrid aire chicas razones ahora versi arte ntame peque mientras llueve veces miedo detr ojal algo puede eres dame 
toronto rap, gang freestyle gold made talk 
trap argentino, otra otro bien fuck 
east coast hip hop, rhyme brooklyn beef lyrical y'all ghetto skit hood salute clap freestyle respect shot check word thug gangsta york who's crime East Coast hip hop regional subgenre hip hop music originated New York City Hip hop recognized originated evolved New York contrast East Coast hip hop music prioritized complex lyrics attentive listening beats The term Coast hip specifically denotes hip hop originating East Coast Northeastern United Southeastern states Georgia instead fall umbrella Southern hip hop Coast hip A notable exception Hampton Roads music centered Virginia produced artists diverse Missy Pharrell Timbaland closely associated New York music scene evolution East Coast hip particularly late
new romantic, remaster demo doesn't flame kiss ordinary boys room single heartbeat skin invisible watching shame bitter extended strange love's other london The New Romantic movement underground subculture movement originated United Kingdom late The movement emerged nightclub scene London Birmingham venues The The New Romantic movement characterised eccentric fashion inspired fashion boutiques Kahn Bell Birmingham PX Early adherents movement referred press names Blitz New Dandies Romantic David Marc Bolan Roxy New Romantics developed fashions inspired glam rock era coupled early Romantic period late early century movement took The term known coined manager innovator Richard James He stated fit Blitz scene Spandau groups tried distance fashion British music acts late early adopted style known epitomise including Steve Strange Duran Spandau A Flock Classix Nouveaux Boy George Culture Ultravox identified New Romantics exhibit visual styles despite link band Japan Adam Ants labelled New Romantic artists repudiated direct connection original A number bands adopted synthesizers helped develop early combined distinctive New Romantic helped national success play major Second British Invasion end original movement largely Although artists associated scene continued enormous commercial success largely abandoned aesthetics There attempts revive movement including Romo
rap metal, burn rise Rap metal subgenre rap rock alternative metal music combines hip hop heavy It usually consists heavy metal guitar funk metal rapped vocals
miami hip hop, bout grind gangsta freestyle fuck shake drop work gotta 
dark trap, fuck chrome suicide demons demon numb toxic bleed bloody lick mask grave waste kill psycho hate bitch freestyle okay murder 
funk, funky betcha you've groove love's gonna sweeter jones since sure gotta dancin' yourself sexy we've lovin' tryin' loving woman share Funk music genre originated African American communities musicians created danceable new form music mixture music genres popular African Americans It melody chord progressions focuses strong rhythmic groove bassline played electric bassist drum played slower tempos popular Funk typically consists complex percussive groove rhythm instruments playing interlocking grooves create Funk uses richly colored extended chords found bebop minor chords added sevenths dominant seventh chords altered ninths originated James development signature groove emphasized heavy emphasis beat measure application swung notes syncopation drum guitar rock musicians Sly Family Stone Jimi fostering improvisation Other musical including Kool Wind Loose The The began adopt develop innovations adding essences genre early like Ohio Players followed derivatives include strain hybrid electronic music funk mix funk mix gangsta rap form funky Cuban dance funk It main influence Washington funk Funk samples breakbeats extensively hip hop electronic dance
sleep, binaural restful meditative loopable rainforest ambient reverb rainfall trickling airy calming soothing shifting tinnitus thunderstorm nature's microwave slumber serene pouring Sleep sedentary state mind It characterized altered relatively inhibited sensory reduced muscle activity reduced interactions It distinguished wakefulness decreased ability react reactive coma disorders sleep displaying active brain occurs repeating body alternates distinct REM sleep Although REM stands eye mode sleep including virtual paralysis A feature sleep experience typically recounted narrative resembles waking life usually later distinguished During systems anabolic helping restore muscular vital processes maintain cognitive play large role function endocrine immune The internal circadian clock promotes sleep daily The diverse purposes mechanisms sleep subject substantial ongoing Sleep highly conserved behavior animal suffer sleep including dyssomnias sleep parasomnias sleepwalking rapid eye movement sleep behavior circadian rhythm sleep The use artificial light substantially altered sleep Common sources artificial light include screens electronic devices smartphones emit large amounts blue form light typically associated This disrupts release hormone melatonin needed regulate
psychedelic rock, mono remaster lucille interview introduction mojo crossroads alternate doctor band medley uncle francisco babe much talkin' goin' talking john sitting Psychedelic rock rock music genre representative psychedelic centered hallucinogenic The music incorporated new electronic sound effects recording extended instrumental Many psychedelic groups differ label applied British American sound psychedelic rock invokes core effects detach user everyday effects represented novelty studio electronic disjunctive song extended instrumental Some earlier psychedelic rock musicians based showcased explicit Indian classical influence called In existed main variants surrealist British psychedelia harder American West Coast While deployed interchangeably term refers specifically extreme ends peak years psychedelic rock milestone events including Summer Love Woodstock Rock international musical movement associated widespread counterculture beginning decline changing loss key movement led surviving performers new musical The genre bridged transition early blues rock progressive rock hard result contributed development heavy Since late revived forms
francoton, tout fais t'es elle laisse plus comme loin sans aller m'en booska dans fait juste c'est t'as pour vais trop 
piano rock, runaway human maybe walking shine before dear these save perfect change 
quiet storm, givin' betcha love's spend share lovin' gotta sweeter since you've special sure gonna sexy glad we've didn't who's dancin' loving Quiet storm radio format genre performed It named title song Smokey album A Quiet radio format pioneered Melvin intern radio station It eventually regarded identifiable subgenre Quiet storm marketed upscale mature audiences falling favor young listeners age hip
boy band, tonight perfect close A boy band loosely defined vocal group consisting young male usually teenage years twenties time singing love songs marketed Many boy bands dance usually giving highly choreographed bands formed evolving church choral gospel music In created talent managers record producers hold Being vocal boy band members play musical recording sessions They similar concept counterparts known girl The popularity boy bands peaked Jackson second time peaked late acts New Kids Take Backstreet Westlife dominated pop time emergence groups One The Big Time The Ballinciaga acts BTS
west coast rap, gangsta niggaz pimp cali pimpin' thang hood neva killa thug ghetto bitches boyz y'all niggas nigga dope skit block playa West Coast hip hop regional genre hip hop music encompasses artists music originated West Coast region United West Coast hip hop began dominate radio play sales standpoint early birth emergence record labels Suge Knight Death Row Ice Lench Mob Records continued success Ruthless
emo rap, hopeless waste fucked scars toxic numb drugs anxiety sober demons problems hate okay fake hurt nightmare suicide poison sorry crash Emo rap fusion genre hip hop emo Originating SoundCloud rap scene genre fuses characteristics hip hop beats lyrical vocals commonly found emo Lil Juice Wrld notable musicians
desi hip hop, punjab punjabi gabru tere jatt putt billo yaar meri kuri tera paisa jaan aaja kadhal bombay yaari sohniye mere balle Desi hip hop term music culture combines influences hip hop Indian term desi referring South Asian The term come alternative rap music pop music involves rappers South Asian
glam rock, teenage really street strange johnny dirty introduction gotta ballad tonight dancing these kiss medley move Glam rock style rock music developed United Kingdom early performed musicians wore outrageous particularly platform shoes Glam artists drew diverse sources music throwaway pop ranging bubblegum pop rock roll science complex art The flamboyant clothing visual styles performers camp described playing gender Glitter rock extreme version glam UK charts inundated glam rock acts The March appearance Rex frontman Marc Bolan music Top wearing glitter cited beginning Other British glam rock artists included David Mott Roxy Music Gary Those central artists Elton Rod Stewart Freddie Mercury adopted glam In United scene Alice Cooper Lou Reed American artists score hit Other American glam artists include New York Suzi Iggy Pop It declined influenced musical genres including punk glam New death rock gothic
uk dance, extended higher without 
punjabi pop, jatt pind munda gabru putt mitran yaari rabb yaar gallan boliyan tere kudi teri tera tenu goli haan desi canada 
indie poptimism, kids running friends gold acoustic dancing drive eyes other california talk someone dreaming touch magic girls together somebody close golden 
punk, bored public suburban police teenage guns kids riot hate violence demo american generation sick bomb order destroy anti surf youth Punk rock known simply music genre emerged Rooted garage punk bands rejected perceived excesses mainstream They typically produced songs melodies singing shouted Punk embraces DIY bands recordings distribute independent record term previously American rock critics early describe garage Certain late early Detroit Iggy bands created music highly influential Glam rock UK New York Dolls New York cited key When movement bearing developed prominent acts included Patti Ramones New York Saints Sex Damned Buzzcocks By late punk major cultural phenomenon It led punk subculture expressing youthful rebellion distinctive styles deliberately offensive leather studded spiked bands safety bondage influence music subculture spread It took root wide range local scenes rejected affiliation In late punk experienced second wave new acts active formative years adopted By early faster aggressive subgenres hardcore punk Minor predominant modes punk Many musicians identifying inspired punk went pursue musical giving rise movements new alternative Following alternative mainstream breakthrough punk rock saw renewed major label interest mainstream appeal rise California bands Green Social The Bad NOFX
slap house, extended lose save 
rap francais, booska mauvais vrai dans tout parano hors trop freestyle sale noir wesh comme c'est temps elle gros demain connais toute 
hoerspiel, teil geheimnis kapitel flucht geschichte schwarze haus falsche suche eine reise drei neue frau erste einem verr angst zwei abschied 
argentine rock, ruta fantasma hombre canci libertad salir tren viento buenos luces malas tiempo cabeza viaje nena vivo ciudad todos espejo juntos Argentine rock locally rock nacional sense rock music composed performed Argentine bands artists rock began recycling hits rock However rising trend composing new songs Spanish traced late garage groups aspiring musicians began composing songs lyrics related local social musical Since Argentine rock started continued uninterrupted evolution distinguishing trait Argentine rock insistence Spanish language Argentine rock today blanket term describing number rock styles
indietronica, eyes before golden people dancing through Indie rock subgenre rock music originated United United Kingdom New Zealand Originally describe independent record term associated music produced initially interchangeably alternative rock pop primary scenes movement cultural scene based convergence noise pop jangle popular large student Independent labels Flying Nun began promote scene New inspiring key college rock bands United States Pixies Other notable scenes grew Manchester thriving use term started shift reference recording companies describe style music produced punk During grunge punk revival bands US Britpop bands UK broke term lost original The term associated bands genres remained dedicated independent By end indie rock developed subgenres related including noise math In changes music industry growing importance internet enabled new wave indie rock bands achieve mainstream leading questions meaningfulness early new group bands played version guitar rock emerged The commercial breakthrough scenes led The The White The Hives The Emo broke mainstream culture early By end proliferation indie bands referred term subgenre certain type indie way Britpop British guitar music
sad rap, hopeless toxic okay numb scars paranoid anxiety rockstar problems hurt waste hate demons losing lately used fake crash sorry drowning Emo rap fusion genre hip hop emo Originating SoundCloud rap scene genre fuses characteristics hip hop beats lyrical vocals commonly found emo Lil Juice Wrld notable musicians
indie soul, yours alright water wait about late work closer talk fool dreaming control gold shine find before feeling change golden together 
turkish pop, yaln olsun beni akustik seni yalan sana bana gece hayat senden vazge stanbul deli yorum masal benim yeter seninle daha Pop music genre popular music originated modern form United States United The terms popular music pop music describes music popular includes disparate During pop music encompassed rock roll styles Rock pop music remained roughly synonymous late pop associated music music appears record charts considered pop genre distinguished chart Identifying factors usually include repeated choruses short songs written basic format rhythms tempos easily danced Much pop music borrows elements styles urban contemporary
puerto rican pop, dime ahora dame eres gracias contigo coraz quien estoy puedo hasta nada ella nunca mujer noche medley 
