genre,definition
pop, anymore sober selfish acoustic butterflies spotlight older idea deserve feels girls honest hurt remind somebody naked girlfriend waste used talk Pop music genre popular music originated modern form United States United The terms popular music pop music describes music popular includes disparate During pop music encompassed rock roll styles Rock pop music remained roughly synonymous late pop associated music music appears record charts considered pop genre distinguished chart Identifying factors usually include repeated choruses short songs written basic format rhythms tempos easily danced Much pop music borrows elements styles urban contemporary
dance pop, spotlight louder acoustic girls selfish girlfriend feels naughty somebody anywhere superstar sexy kiss extended sober marry megamix stronger dare naked popular music subgenre originated late early It generally uptempo music intended nightclubs intention danceable suitable contemporary hit Developing combination dance pop influences generally characterised strong beats uncomplicated song structures generally similar pop music dance emphasis melody catchy The tends despite notable highly having borrowed influences varied artists Such include contemporary new jack funk pop popular mainstream style music numerous artists groups perform Notable artists include Britney Kylie Christina Spice Paula Backstreet Michael Jennifer Janet Katy Lady Years Justin Ava
rap, nigga gangsta hood niggas dope bitch niggaz y'all rich shit bout check murda bitches realest poppin poppin' fuck pussy momma Hip hop music known rap genre popular music originated New York City It consists stylized rhythmic music built drum commonly accompanies rhythmic rhyming speech It developed hip hop subculture defined key stylistic break graffiti Other elements include sampling beats bass lines records synthesized beats rhythmic While refer solely properly denotes practice entire The term hip hop music synonymously term rap rapping required component hip hop genre incorporate elements hip hop including instrumental hop musical genre culture formed block parties increasingly popular New York particularly African American youth residing At block DJs played percussive breaks popular songs turntables DJ mixer able play breaks copies alternating extending Hip early evolution occurred sampling technology drum machines widely available Turntablist techniques scratching beatmatching developed Rapping developed vocal style artist speaks chants rhythmically instrumental synthesized hop music officially recorded play radio television largely poverty birth lack acceptance outside ghetto Old school hip hop mainstream wave marked disco influence The marked diversification hip hop genre developed complex styles spread New school hip hop second marked electro led golden age hip innovative period developed hip album The gangsta rap focused violent lifestyles impoverished conditions African American gained popularity West Coast hip hop dominated East Coast hip hop dominated jazz alternative hip hardcore Hip hop continued diversify time regional styles Southern rap Atlanta hip Hip hop genre music genre popularity hip hop music continued late hip hop influences increasingly finding way genres popular neo nu The United States saw success regional styles Southern genre emphasized beats music alternative hip hop began secure place crossover success During late early rappers able build following online methods music social media mainstream hip hop took sensitive direction following commercial decline gangsta The trap mumble rap subgenres popular form hip hop early In rock music usurped hip hop popular genre United
rock, remaster band banter interview pigs demo writing shapes crossfire swallow guitar satellite hole pictures stage diddley century isolation gimme thirteen Rock music broad genre popular music originated United States late early developing range different styles particularly United States United It roots rock style drew directly blues rhythm blues genres music country Rock drew strongly number genres electric blues incorporated influences musical For rock centered electric usually rock group electric bass rock music time signature genre extremely Like pop lyrics stress romantic love address wide variety themes frequently social musicians began advance album ahead single dominant form recorded music expression Beatles forefront Their contributions lent genre cultural legitimacy mainstream initiated album era music industry By late number distinct rock music subgenres including hybrids like blues folk country southern raga jazz contributed development psychedelic influenced countercultural psychedelic hippie New genres emerged included progressive extended artistic glam highlighted showmanship visual diverse enduring subgenre heavy emphasized In second half punk rock reacted producing energetic social political Punk influence new eventually alternative alternative rock began dominate rock music break mainstream form indie Further fusion subgenres including pop electronic rap rap conscious attempts revisit including garage revivals The saw slow decline rock mainstream popularity cultural hip hop surpassing popular genre United embodied served vehicle cultural social leading major subcultures including mods rockers United Kingdom hippie counterculture spread San Francisco US punk culture spawned emo Inheriting folk tradition protest rock music associated political activism changes social attitudes drug seen expression youth revolt adult consumerism At commercially highly leading charges selling
hip hop, y'all gangsta nigga niggaz scarface hood ghetto lyrical dope niggas skit boyz check ya'll freestyle momma bottles shit kool beef Hip hop music known rap genre popular music originated New York City It consists stylized rhythmic music built drum commonly accompanies rhythmic rhyming speech It developed hip hop subculture defined key stylistic break graffiti Other elements include sampling beats bass lines records synthesized beats rhythmic While refer solely properly denotes practice entire The term hip hop music synonymously term rap rapping required component hip hop genre incorporate elements hip hop including instrumental hop musical genre culture formed block parties increasingly popular New York particularly African American youth residing At block DJs played percussive breaks popular songs turntables DJ mixer able play breaks copies alternating extending Hip early evolution occurred sampling technology drum machines widely available Turntablist techniques scratching beatmatching developed Rapping developed vocal style artist speaks chants rhythmically instrumental synthesized hop music officially recorded play radio television largely poverty birth lack acceptance outside ghetto Old school hip hop mainstream wave marked disco influence The marked diversification hip hop genre developed complex styles spread New school hip hop second marked electro led golden age hip innovative period developed hip album The gangsta rap focused violent lifestyles impoverished conditions African American gained popularity West Coast hip hop dominated East Coast hip hop dominated jazz alternative hip hardcore Hip hop continued diversify time regional styles Southern rap Atlanta hip Hip hop genre music genre popularity hip hop music continued late hip hop influences increasingly finding way genres popular neo nu The United States saw success regional styles Southern genre emphasized beats music alternative hip hop began secure place crossover success During late early rappers able build following online methods music social media mainstream hip hop took sensitive direction following commercial decline gangsta The trap mumble rap subgenres popular form hip hop early In rock music usurped hip hop popular genre United
trap latino, perreo nota quiere mami reggaeton gata envidia sexo ella duro soltera dime quieren papi calle nena dale toco prende vamo 
pop rap, hood dope boyz nigga shawty bout gangsta haters swag realest turnt imma speaks y'all poppin poppin' gettin baddest stunt wassup Pop rap known pop hip melodic melodic genre music fusing lyricism hip hop music pop preference melodious vocals catchy This genre gained mainstream popularity influences roots pop rap trace hip hop artists LL Cool Beastie The lyrics choruses similar heard pop
reggaeton, perreo gata quiere nena sexo ella vamo quieren pegate mami dale dime adicto envidia rompe cuerpo papi caliente nota bandida Reggaeton known reggaetón reguetón music style Puerto Rico influenced Reggae en Español Hip Bomba It evolved dancehall influenced American hip Latin Caribbean Vocals include rapping typically regarded popular music genres including Puerto Dominican Over genre seen increased popularity Latin acceptance mainstream Western
edm, extended abgt mixed louder asot crank lose higher together heartbeat pump alive rave feels flashback bounce continuous lights ultra drop EDM refer
modern rock, kids emily commentary acoustic fever hanging medicine friends wolf demo everyone half weight golden strangers american brother wasted strange these Modern rock umbrella term describe rock music found college rock radio Some radio stations use term distinguish classic based rock
trap, hood nigga poppin dope niggas ridin ballin gettin gangsta bout drank paid boyz realest shit racks rich bankroll talkin gucci Trap subgenre hip hop music originated Southern United States The genre gets Atlanta slang word house exclusively sell Trap music uses synthesized drums characterized complex tuned kick drums long decay Roland drum lyrical content focuses drug use urban It utilizes instruments focuses exclusively snare drums genre include producers Kurtis Mannie Shawty DJ Screw rappers Young Gucci Mane coined term album Trap The modern trap sound popularized producer Lex produced influential Waka Flocka Flame album Flockaveli cofounded prolific production team crossing mainstream trap popular forms American consistently dominating Billboard Hot artists Cardi Lil Uzi Post Young Travis Scott achieving chart songs featuring production inspired trap It influenced music pop Ariana Miley Rihanna Its influence heard reggaetón In popular form music time Nielsen coinciding continued rise In song Town Lil Nas X Billy Ray broke record spending weeks Billboard Hot fastest song reach Diamond
latin pop, versi dame contigo date volverte zame estar coraz algo ahora dime alguna puedo nada vivir fuerte fuera rame sabes eres Latin pop Spanish Pop pop music subgenre fusion music production Latin music genres Latin America Originating Latin pop musicians Portuguese Brazilian Romance Creole Latin pop usually combines upbeat Latin music American pop Latin pop commonly associated dance
post-teen pop, boyfriend acoustic girls mess kiss perfect liar jingle heartbreak somebody worth hate naked boys middle stronger sorry myself about dangerous 
pop dance, extended mixed louder asot anywhere lose continuous feels higher somebody pump losing without find alive heartbeat together lights rave body popular music subgenre originated late early It generally uptempo music intended nightclubs intention danceable suitable contemporary hit Developing combination dance pop influences generally characterised strong beats uncomplicated song structures generally similar pop music dance emphasis melody catchy The tends despite notable highly having borrowed influences varied artists Such include contemporary new jack funk pop popular mainstream style music numerous artists groups perform Notable artists include Britney Kylie Christina Spice Paula Backstreet Michael Jennifer Janet Katy Lady Years Justin Ava
musica mexicana, corrido sinaloense clave muchacho compa contrabando tragos javier carga comandante ayudante laurita manuel regalo compro jefe compadres plebes florita andamos The music Mexico diverse features wide range musical genres performance It influenced variety notably deriving culture It rarely contains influences Asians Hispanic Latino Music expression Mexican beginning nineteenth
permanent wave, remaster satellite interview demo sister lightning hole band american strange introduction favorite johnny london girls dreaming we're remastered there's sunday A permanent commonly called perm permanent called distinguish hairstyle consisting waves curls set The curls number applied thermal chemical In chemicals applied wrapped forms produce waves The process chemical straightening hair flattened instead curled chemical
tropical house, extended mixed feels higher lose acoustic losing somebody closer follow lights fade found body alive paradise mine again control together Tropical known trop subgenre house derivation tropical elements dancehall Balearic Artists genre featured summer festivals The genre popularized artists including Thomas Lost Seeb term began joke Australian producer Thomas gone gain popularity The term confused tropical genre instead combines feeling trance beats progressive electro
mellow gold, band banter interview hearts lovin' woman helpless takin' someone fool drivin' anyway you've bluebird stranger maybe dancin' ticket heartbreak goodnight 
soft rock, band banter lovin' someone fool whenever woman really hearts interview maybe anyone love's tomorrow's takin' you've words remaster bluebird 'til Soft rock known light rock derivative form pop rock originated late region Southern California United The style smoothed edges pop relying melodic songs lush Soft rock prevalent radio eventually metamorphosed form synthesized music adult contemporary
alternative metal, crawl bleed suffer enemy burn drown violent torn sick bullet ashes killing halo skin scream breakdown destroy army slave bleeding Alternative metal known genre heavy metal music combines heavy metal influences alternative rock genres normally associated Alternative metal bands characterized heavily guitar mixture accessible melodic vocals harsh vocals unconventional sounds heavy metal The term use came prominence genres considered alternative metal movement included rap metal funk influenced prominent nu Nu metal expands alternative metal combining vocal stylings downtuned riffs elements hip thrash hardcore punk industrial metal began bands like Faith No Living The genre achieved success popularity bands like Alice In late early nu metal achieved mainstream popularity mainstream success bands like Limp Papa System Linkin Slipknot After nu popularity began bands like Limp Bizkit experiencing decline album sales nu metal bands moving alternative popularity continued continued success bands like Godsmack System Down mainstream success emerging bands like Three Days Grace Breaking
pop rock, commentary acoustic satellite breakdown hurricane sister anyway maybe miles california american interview ordinary favorite lucky won't someday carry crash daylight Pop rock typeset fusion genre emphasis professional songwriting recording emphasis attitude rock Originating late alternative normal rock early pop rock influenced original style rock roll It viewed distinct genre field music overlaps pop The detractors pop rock deride commercial product authentic rock
k-pop, inst japanese starry confession flower airplane butterfly rewind crush because ending starlight prod dear promise sorry destiny paradise star liar short Korean popular form popular music originating South Korea South Korean It includes styles genres hip electronic classical traditional Korean music The term popular South Korean pop music called gayo While general term popular music South Korea pop music colloquially narrower sense Korean music artists associated entertainment idol industry regardless modern form genre emerged formation hip hop boy band Seo Taiji Their experimentation different styles genres music integration foreign musical elements helped reshape modernize South contemporary music culture began idol music grew subculture amassed enormous fandoms teenagers young After slump early idol TVXQ BoA started new generation idols broke music genre neighboring Japanese market continue popularize internationally With advent online social networking services South Korean TV current spread South Korean known Korean seen East Asia Southeast Latin North Southern Africa East Middle East Western gaining international experienced significant growth marking increase revenue As Korean popular music ranked number music markets worldwide according International Federation Phonographic Music Report BTS Blackpink cited artists leading market In experienced year experienced growth positioned major market
electropop, sober champagne youth girls numb acoustic somebody kiss forget cruel cherry drive human closer strangers boys hearts blame feels gold Electropop hybrid music genre combining elements electronic pop Writer Hollin Jones described variant heavy emphasis electronic The genre developed saw revival popularity influence late
nueva musica mexicana, corrido muchacho javier andamos compa sinaloense popurr chino disculpe chapo centenario arturo apague captura estilo botellas iniciales clave chavo gordo 
country, redneck drinkin' honky beer holdin' 'til hillbilly thinks cowboys wouldn't workin' folsom somebody's tulsa truck hangin' tryin' whiskey rudolph tennessee Country called country genre popular music originated church music Southern gospel American folk music forms including cowboy Western music styles New Red Texas Its popularized roots originate Southern Southwestern United States early music consists ballads dance tunes commonly known Tonk generally simple folk harmonies accompanied string instruments electric acoustic steel guitars pedal steels fiddles Blues modes extensively recorded term country music gained popularity preference hillbilly came encompass Western evolved parallel hillbilly music similar In United country music listened rush hour radio genre evening second popular morning term country music today describe styles The origins country music found folk music working class Americans American It historical roots indigenous music North Celtic early music British Irish traditional singing French folk traditional folk music
album rock, band remaster guitar drum banter interview takin' gimme breakdown crossroads drivin' join keyboard heartbreaker lucille shock pictures woman hungry boys rock originally called FM radio format created United States focuses repertoire rock albums currently associated classic radio established US radio stations dedicated playing album tracks rock artists hard rock progressive rock In AOR characterized mellifluous sound sophisticated production considerable dependence melodic Using research formal programming create album rock format greater commercial AOR format achieved tremendous popularity late early early radio term normally abbreviation meaning radio stations specialized classic rock recorded late term commonly conflated radio format uses initialism AOR covers album tracks range rock soft rock pop
contemporary country, beer drinkin' redneck drink dirt whiskey tequila cowboy truck workin' commentary drinking gets drunk damn hillbilly hometown american kinda 'til 
canadian pop, snow until kiss smile santa find sorry somebody save tonight leave nobody holy these perfect talk won't true 
southern hip hop, hood niggas nigga dope speaks gangsta ridin shawty bout ballin gettin drank boyz hustle pimp haters thug throwed niggaz grind Southern hip known Southern South Coast hip dirty blanket term regional genre American hip hop music emerged Southern United especially New cities constitute rap music reaction flow hip hop culture New York City Los Angeles area considered major American hip hop alongside East Coast hip hop West Coast hip Many early Southern rap artists released music independently mixtapes encountering difficulty securing contracts By early Southern artists attained decade went mainstream underground varieties Southern hip hop popular influential entire
desi pop, tere teri pyaar jatt tera punjabi ishq jaane yaar pyar mere zindagi meri pehli mera yaad baarish phir jaan aaja 
filmi, chinna zindagi kanna jaane mere mujhe pyar kabhi tere raat amma aayiram meri unnai yaaro maine teri kadhal suno neela Filmi music soundtracks music produced mainstream motion picture industry written performed Indian In music directors main body songs performed playback singers genre represents music sales market music tends appeal Pakistan especially Indian Songs different languages depending target example Hindi Playback singers usually noted ability sing charisma Filmi playback level success appeal tied involvement film soundtracks cinema releases highest box office Song Dance Indian archive presentation filmi praised generally fitting term tradition exuberant music melodrama closely identified Hindi commercial cinema produced Bombay truly
urban contemporary, spend grown unconditional sexy thinkin' girlfriend special betcha love's deserve fallin' superstar gotta tonight giving holla freaky changed somebody treat Urban contemporary known urban hip urban simply music radio The term coined New York radio DJ Frankie Crocker early synonym Black Urban contemporary radio stations feature playlist entirely Black genres quiet urban adult hip Latin music Latin Chicano Chicano Caribbean music reggae Urban contemporary developed characteristics genres urban music largely US virtually urban contemporary formatted radio stations United States located cities sizeable New York New Los Hartford contemporary music includes contemporary elements incorporate production elements found urban urban urban
melodic rap, pull freestyle rich fuck friends play Pop rap known pop hip melodic melodic genre music fusing lyricism hip hop music pop preference melodious vocals catchy This genre gained mainstream popularity influences roots pop rap trace hip hop artists LL Cool Beastie The lyrics choruses similar heard pop
hard rock, drum guitar screaming hell band outlaw evil crawl burnin' remaster writing attitude loaded prisoner hole shook rebel devil highway hunter Hard rock heavy rock loosely defined subgenre rock music typified aggressive vocals distorted electric Hard rock began psychedelic blues rock Some earliest hard rock music produced Rolling Cream Jimi Hendrix In late bands Jeff Beck Iron Led Golden Steppenwolf Deep Purple produced hard genre developed major form popular music Led Zeppelin Deep Purple joined Van During hard rock bands moved away hard rock roots pop Established bands comeback hard rock reached commercial peak glam metal bands Bon Jovi Def Leppard rawer sounds Guns Roses followed great success later rock began losing popularity commercial success urban grunge later Britpop Despite bands adopted hard rock sound saw renewed interest established attempts new bands emerged garage rock revival Out movement came garage rock bands like The White Interpol later Black In bands managed sustain highly successful recording
electro house, extended rave crank arcade louder mixed blackout drop pump riot bounce lose bump heartbeat techno amsterdam alive move higher signal Electro house genre electronic dance music characterized heavy bass tempo beats The term describe music DJ Mag Top including Benny Steve Aoki
nu metal, suffer bleed crawl enemy burn bullet damage violent destroy slave scream torn buried skin sick feed ashes beneath killing drowning Nu metal stylized subgenre alternative metal combines elements heavy metal music elements music genres hip alternative Nu metal bands drawn elements influences variety musical including multiple genres heavy Nu metal rarely features guitar solos displays technical genre heavily syncopated based guitar Many nu metal guitarists use guitars produce heavier DJs occasionally featured nu metal provide instrumentation turntable scratching electronic Vocal styles nu metal include screaming Nu metal key genres new wave American heavy metal popular late bands artists Limp Slipknot Kid Rock releasing albums sold millions Nu popularity continued early bands Papa selling came peak Linkin album Hybrid oversaturation bands combined underperformance releases led nu leading rise metalcore nu metal bands disbanding abandoning established sound favor nu metal bands combine nu metal genres metalcore nu metal bands early returned nu metal Bands like Of Mice Issues My Ticket Home combine nu metal metalcore Artists like Poppy Rina Sawayama integrate nu metal sounds electronic pop music late early
indie pop, audiotree july swimming window boys demo untitled used talk pink favorite california birthday half drunk snow darling heavy cherry sorry Indie pop typeset music genre subculture combines guitar pop DIY ethic opposition style tone mainstream pop It originated British late subsequently generated thriving club gig Compared indie genre relatively In later definition indie pop bifurcated mean bands unrelated DIY pop Subgenres include chamber pop twee
